timestamp,title,link,vader_sentiment,finbert_sentiment
"Mon, 31 Mar 2025 07:00:00 GMT",Impairment of theta oscillations in the hippocampal CA1 region may mediate age-dependent movement alternations in the 5xFAD mouse model of Alzheimer’s disease - Nature,https://news.google.com/rss/articles/CBMiX0FVX3lxTFBoUHJSQ2JCTW1HUzkwRFo3b3c3bjJGNG5xQVZCeG5ZUUVZSU5BcV9iSWhUUm05VVdXWTZrQ05wU0tmTjZfLWtJbFlUNWxzVk5yclpkV3pMSW9HYVBmWk80?oc=5,0.0,0
"Thu, 04 Sep 2025 07:00:00 GMT",SEMO Named to Phi Theta Kappa 2025 Transfer Honor Roll - Southeast Missouri State University,https://news.google.com/rss/articles/CBMijAFBVV95cUxPRVI4MjlKVTFidjFnWFhqYkRVcjlXMG9QdW9aU2NIbl9jMjJESTNISmRSS3BXMVJ6ZVBsR2l5Z0tZc0xTWFZmR29ycjRGSHkwRWVfT21yUDFsYzA4QkQyRlBNQUxlZXhzRkk3aE1QWVgxTnhFRFhlT0pCSE5aRkw0QkQwRmdwMDVSZTNvbw?oc=5,0.4939,0
"Wed, 23 Jul 2025 07:00:00 GMT",Dignitas and Theta Labs Launch AI Agent to Transform Esports Tournament Administration and Fan Engagement - Yahoo Finance,https://news.google.com/rss/articles/CBMigAFBVV95cUxNdF9pYUREQWp1aFR4X3hkU2dnd3dUbjdTdjdwMENYN3ZfQVRsNGhkUnY3MHpFUlRMamFMaWpTVW0wN0xPWDN5N1FaTFk4cUhSUjJPRS02VEZyWG5sUDBkcW1jOXFDakphWW9HdVR3LWZmWFQ5U2Y3M1lsRjlRUUphNg?oc=5,0.6486,0
"Mon, 02 Jun 2025 19:51:45 GMT",We Tried Immersion Contrast Therapy at Theta Wellness - 417 Magazine,https://news.google.com/rss/articles/CBMigAFBVV95cUxNM1ZtdFdTZjYyWjFiZlc2Nl9QY0VIRmJyd3YxUmcyRE1YWHNMTkxJUk9mUmE1ekM2ZGpBbHhDY25XU0NEbVdaMkhQVHFNTXJtWU5IUVJiWHBLTHhlWDR1cHl4TzNIdS1zejhsX2hIYWotNWpnV1MtWm9YRjNMY0M0UA?oc=5,0.4404,0
"Mon, 14 Jul 2025 07:00:00 GMT","Theta Pod offers four-in-one therapy for relaxation, mental health benefits - Click2Houston",https://news.google.com/rss/articles/CBMixgFBVV95cUxOY0dDbVpLS3dMSGNvZmM1TFZWN0ZvSkJyVGVxSmp0MUtmM1JRc3UwRHRLdUZ5U3RnRkp3eFg3NHZfRDBHcGZ6NmxGUlJQeVhTS1A0a3FTcEZHRDl6U3MzRFJ2cVZOcC1tRWRLRWktc3BnY2ZkZFhXNFQta2hTWjBRWUoxeVoxQTRhOEpFLVJVRi10S0xzcHZIcWpYZ2RPb2lveUswSFZBTnlKbVA4aWlvTmJSNTlkTHdHcWZ3Ulc1QWFkbGRwcGc?oc=5,0.7184,0
"Wed, 19 Feb 2025 08:00:00 GMT","Theta Chi fraternity chapter at FSU suspended, under investigation - Tallahassee Democrat",https://news.google.com/rss/articles/CBMi7AFBVV95cUxQeF9zdml3SHJIeXM2RU1DNEU3TkJwVGlkRE85Xy16emc3UlY1eEwzeUViazl6cUl2a1FNLVJSY3FVbVAtMHdzM1pFTDhjOXlIZkEyQndhNkQwR1ZXX1VwZGUxYVhOcGIwWEF5SlRkRXQ3U3lvOTNocFoxRVJ3eXo0N2l6cXZxMHhpN09sN2s5UFNoMG5VNmhBNzVKVzk2ZExiaFIxRXQwNEZRYzRFVzVmcUhsZGhRZXFtT3BHR1BEa2JuTGxmUnFHQ2ZRWnVFUWJYbG9FdmdIaXFwZ2VKWExLb3NBdjd0cGtfYU5DVg?oc=5,-0.4767,0
"Fri, 04 Apr 2025 07:00:00 GMT",2025 Phi Alpha Theta Conference a Success! - University of Montana,https://news.google.com/rss/articles/CBMiaEFVX3lxTE1NRFN1T2hnM3lUeVR4UGVQTHR1Rm9rS1RhcHNpU0lSQldSbHA0RmJxYTFzOGxXc1RXaFJUV2gxSVVrUDZ5WGx2Mk5uRlVzajdKbXR5TDBUWkk1eGcxd2VFVEswdXNPU2dp?oc=5,0.6114,0
"Thu, 14 Aug 2025 07:00:00 GMT",TCNJ named to Phi Theta Kappa honor roll for second straight year - The College of New Jersey | News,https://news.google.com/rss/articles/CBMiZ0FVX3lxTE5jdFhfMUxUX0xKZEloSW05eG1fU0RaZnZnOG05MV9HenkwT1ZEck53aU5iMGg3aWVKeUNta3JSUS01OGxIWVFFc1owb2sza0MxM3g2YjJKVzd5eUlvU1VvS0FLNG5ZTXc?oc=5,0.6249,0
"Thu, 06 Feb 2025 08:00:00 GMT",Relationship between regional relative theta power and amyloid deposition in mild cognitive impairment: an exploratory study - Frontiers,https://news.google.com/rss/articles/CBMilAFBVV95cUxNelYtZXpHQ0wzbE85UTVLR005RGZOOWN4RU8xbDNyaTZVRnptYTRCdGZ5QWYtT1hjblZtbFJ6Vjl3WWZPbWRHblNqaW9uODZlVVk5TjF0TUlidzNUYTRkZVJmMWZJZ2VjTG9zWVhIb3dDOEZqNmhMVzhnMmZaUS12TERzdnhCUEZ1TWlCWFN4VlFucTMz?oc=5,0.0,0
"Mon, 31 Mar 2025 07:00:00 GMT",Miami Dade College Students Receive Top Scholarships From Phi Theta Kappa Honor Society - MDC News,https://news.google.com/rss/articles/CBMiwgFBVV95cUxNZzBPTEdxRy1OUG9rb3dWWG5XRUFYb1R4SkVmaFVHcUlsOE44Q3JfQ0RoUWQ5SnpOWTRzM1lETko0V3NCLXdNbkVHWUdTSHRrTGhGX0FWTXFkT3FTcXJ6YjBoUnphbHdVbWM1NmNlU3NLUm9lV3RFSUctMWptaTI2UmZNcE1hbTVDdWFSZjN2RFBISTM0TE1YN1JvUTJfMU56dEhhZjNqSkF0a3BMdTYxOVloUThfSFM1di1RS1Y2WW92UQ?oc=5,0.6124,0
"Tue, 21 Oct 2025 04:52:20 GMT",TGM raises US$6m for TGME gold project development - The Australian,https://news.google.com/rss/articles/CBMijAJBVV95cUxOd2RKM3F3ZUVPSzlobjRTU3o3WjVHdkxqMmpBY0lDaXdwOUUwUk9ZemJsY1pFM3hldV9mU3F6Z3U4elVQUmM5Y1cxZnF2RjA0TEtGeXRSRGFjWDU0MmlRVmlWSFFSS0ZLbUFqS3o2TjcxcElQcHdPSVVMcTNtTjg5Y0s5WDRfTGZDZnl0VFdUOF9obmZIVmlRTHpUNVR6OGFHX3VIMkNzNEl5RC1jTmRfRHdLRzFwN3pxb0JNM1dfMko2MTRzcnBWLWlnb0pZZnJnTzViSktLX1VPU0FOQ0g3Q1hCTXBxMHJfOGFNR2ZNMVY3U1pNMWI3ZlFKaHkxaFF6dzdTMHNnNElOQ0tf0gGSAkFVX3lxTE9KMTZKSkdKdEZob0hINXlwTDY1T1Bsa2NwVXhBTUtQaDNHVjlLczhuYnZOSS1QVmFTWTFCVGtBV25nWEJKdVB4THVxYkdfSHJNT2d1OUZRbFhEWmNPRGVnUElobHJYZDg5WFRldWhkYVZ4ZHRIT0dGU29nZm5iWWRHWUkybDdKZURaWUlIWGZzaVc0TlNGTW1wbU5rMmhwbXIzUnNZYWwxeTBvS0xhek1JWmktTTlYYkRCc3UtMUhwM3hhejVYMzdpckRtbnFuU3ZzWFFBSUNSQnVDWDBqY0xhNUNRdmlCcENxWjVmVHVpM05HU0VObzk1NkxkaWl2ZG05VmNOZlI1TURydEJ2ZDJvbmc?oc=5,0.0,0
"Tue, 29 Apr 2025 07:00:00 GMT",Cross-frequency neuromodulation: leveraging theta-gamma coupling for cognitive rehabilitation in MCI patients - Frontiers,https://news.google.com/rss/articles/CBMinAFBVV95cUxOOG9IeGFhN1RzVUI0XzE2MV95bWpvMTJ5X0pYMGdsenBoN1hkN29vN2czSl9XNHJXSVlxYVNaUmV6SDd5bllwRldmTTRZTXhVelBjOXA1SENNZ2FsZU1qR3RLVm91UFhDMG9IQ05Oa3NCSHFsRG5uM0RiWkkycW5wYTludjdVZjVIa0ttMTRGRW54NmN3RmlLZjM1Wmw?oc=5,0.0,0
"Thu, 31 Jul 2025 16:04:01 GMT",Intuitive virtual reality based frontal-midline theta neurofeedback: a feasibility study in young ages - Frontiers,https://news.google.com/rss/articles/CBMimAFBVV95cUxNcjV2aWp1emhsWWhJMEFjQXl3Z0d6VFRhTWdVQmNWeksxX012NzRMNEpwMGIxd3VudTNlZk9mdlZDUGhHZW9Wbzk5eXkxOEdHVXhuc0VyLTc5a2t4T09ROWVhckRJRTBuRmpvWlNjelNBX1RnTUVUVWdwcVc2TFA5SjhndEduUnJWei1oVzdqTElkRF9aZHpsTw?oc=5,0.0,0
"Sat, 11 Jan 2025 08:00:00 GMT",Reduction in EEG theta power as a potential marker for spatial disorientation during flight - Nature,https://news.google.com/rss/articles/CBMiX0FVX3lxTFBwMnl4WDhudFd6RUY5LUZucFVvTkNkSFR0anZ0YUlSbTJKeGpLLUFONkNONHJzZUwyMmJnSzM4UXRhbDlUam5xd1JObXJKRjBMNUppQ2x0bmVlSjYxSjNN?oc=5,0.0,0
"Fri, 22 Nov 2024 08:00:00 GMT",WT’s Phi Delta Theta Chapter Earns National Recognition - West Texas A&M University,https://news.google.com/rss/articles/CBMimgFBVV95cUxNVWc0ZGdVNFhoczJCbGk1NVBoZjdYbGRjb3hhVHgySUlRdlhHWUxibkxPLUpmSTJvOXVhdjVXdHZZTlM0Z19QWnZRMFprRnhxTFRxb2NLS3dJdlktTmFsYUZJQ3hsTGRHeUVJNlB0dWVaVmkzRkNPcURtU3NIdG56ZkNaY2NJMGxudUQtOFJ6NElic21uTmdxNWdB?oc=5,0.0,0
"Thu, 14 Nov 2024 08:00:00 GMT",Lateral prefrontal theta oscillations causally drive a computational mechanism underlying conflict expectation and adaptation - Nature,https://news.google.com/rss/articles/CBMiX0FVX3lxTE1TYTNLWDJtc0tEUDRMUnI3VG0xWEVxVFJrNHRfWE9UanFieTFrTERjMmNINEZwM1lGWURTcjlsTWgxX3ZkaWVZZTRFNUNORkNjRjBybmRCTjFWalBCclBr?oc=5,-0.3182,0
"Tue, 01 Apr 2025 01:24:04 GMT",Harnessing theta waves: tACS as a breakthrough in alleviating post-stroke chronic pain - Frontiers,https://news.google.com/rss/articles/CBMilAFBVV95cUxPa042Ni1hakNoMzlzUzJYNzdlTUZsekxoZzlxcnpSVzJpYXZSZF84UGxCU0NJN0J2NU5pT3I5bHI3aGpfX3lLeVk0Ujg0bHJHTVpFQW9EaFhOVW9yRVdOZVAwajRUdUlham5mX3FUVVRkelp6ZzBRYWVnNTA5dVJrLW1TcTNhWHQzRXBjbkl2SjZMenVs?oc=5,-0.5106,0
"Wed, 15 Oct 2025 07:00:00 GMT","Retired Illinois Appellate Court Justice and Member of the Glen Ellyn Area Alumnae Chapter of Delta Sigma Theta Sorority, Inc. Shelvin Louise Marie Hall Dies - The Citizen Newspaper Group",https://news.google.com/rss/articles/CBMisAJBVV95cUxPakNhOE14WGZzV2Q2NjdieUJOTU84ZlJxNjVKOWlXamFjYkc4MHBKUXRGSFhZd3dVYkNaSmVrbi1ueU1Cc1B0WGhXYUtEeGlHNUl6b1pIRGlxLWE5bVU2S09SZTAyOU1HekNfMDk5emM2Y2laU0oxV04xMlEtOU0zcEdNa2RrY2NBaExGRjM1MDMxcmVCUllTVmljMVVQMkpTY2FOYmdfcmhnU3V3V054ZkFib0Z1ZWJSLUlxN3JKc2YtdFJIYzhxUTZpSXVGUmhlb2k5YUlhNl9QeWdwdmhJNU5oZFpkMVpOZFdQNnpxRlNQdi04TU5wZXExQXUwRENQY04zZ21fX0pvLUdVY0NjeThjM2Ffd0k1OXR6VkE4OTh0WlZWdzlYTjhTb0tYM0ZU?oc=5,0.5267,0
"Sun, 27 Apr 2025 01:16:13 GMT",Preparation of Substituted Heterocycles and Their Use as DNA Polymerase Theta (POLQ) Inhibitors - ACS Publications,https://news.google.com/rss/articles/CBMiZkFVX3lxTE9FMEFJMVZFOTI4c2VQcW5VYTNrTzU3TUY4cHpuZHZLN25ocE01UTJvMThNN2R0ZWh6dGMtVjFqX293RlRPQmtRNzhPXzFBeFo3bGMzSGRCdGJObm9Zd09SZUhtdEF4QQ?oc=5,-0.25,0
"Mon, 13 Jan 2025 08:00:00 GMT",Theta transcranial alternating current stimulation over the prefrontal cortex enhances theta power and working memory performance - Frontiers,https://news.google.com/rss/articles/CBMikgFBVV95cUxPeTB3NnhqTGxVU0ZrRk9Kc2pFRHktRFdsZW5yX2w0STl0MEpIejg1WkJhV0ZiVXhEWTNzODMyc0VKVndXSDJBaUhDWVg5N0JxbEFDSU8yS2JpVVNBZnkxVnN6UG91bVFRcncwSldaUHlfeF80U2p0Yzk5V0tkdF80Zm1wNVV2OU9aQ0F4UXBFWm0tQQ?oc=5,0.0,0
"Mon, 20 Oct 2025 23:48:09 GMT",Theta Gold Mines Secures Additional Funding and Convertible Loan Conversion - Sharecafe,https://news.google.com/rss/articles/CBMitwFBVV95cUxQc3pZc0h2WV9SV2JpYkFzeUpiRVVBZmdlZHNUaU5zck5BVExpdkJJMjZEREJyYnZmLU5NZW1NajltajZrZFFwMmd4VThKU1F5YWQ4Z0ZQMDlIMDIyX01KbWlZZTB0eXBBMGRmZ2hRRzRaTHNnQkMxa01VQWJuZ2NJWGxnZURLUmJrcTJyWXlSMjhwbkZGdE4xZi12aEtMZXUwb0owbldOWjhoeUlsUnJOSGExTW5OQUk?oc=5,0.3182,0
"Wed, 20 Nov 2024 08:00:00 GMT",MSU puts Theta Chi fraternity on interim suspension in connection to alleged hazing - The State News,https://news.google.com/rss/articles/CBMivgFBVV95cUxQcU1YSTluamt6aTFyd2Y5VlhUalY3RWEtWXJzTEY0UU1tYUdJVFFUYUJCS3ozVVFZWGVrM2w0ZWh1RDdud3pPb3VaV3lsblBYUXE3U0R3T2V0UUxWRHB2TVAtN3lkeHZiY3liak1GLVZfeGpCaVpFY0VqVF9fYkFVLUVGUTdIdDhkaVVoUDBvbTFtLVdoaEJZUmhWMDI5SVBwU2xLbGVjWlNBN056SzAtRDIxZWM0QW5nazd2MmNR?oc=5,0.0,0
"Tue, 28 Dec 2021 09:36:23 GMT","Theta Network price today, THETA to USD live price, marketcap and chart - CoinMarketCap",https://news.google.com/rss/articles/CBMiYEFVX3lxTFBoYVh0clI2bGRXd1lHQlEwUnkweDdMQ2NpUkVrMDZ1SVdKNlM5MDBvd1RxY3IzNmZHcGMtU3FFWS1nZzZDY293eVhUZjZyemJIV1F6TU5ZUElpYTFqVU5OZw?oc=5,0.0,0
"Tue, 03 Dec 2024 08:00:00 GMT",Could Intermittent Theta Burst Stimulation Treat Schizophrenia? - Psychiatrist.com,https://news.google.com/rss/articles/CBMingFBVV95cUxQTDlyT0NKc25oRXg5S1pSb0FYSUlYeHA1X0RvdGkzVmJRQ0pQeGNtSkg2Sml5b2hjTzFhSWZidDNBRFc5aDRBWE94WnBWU3FKQjFZQVNTd0RCVnAwd1lRWUZqMi1JYU53V2JvY1EySzA5Q19vTndxWnZUeU5kaVdQdVR0VVlYa0dtckF5RXVNUXIyWGN3ajlKbVFBZnI5UQ?oc=5,0.4019,0
"Fri, 25 Oct 2024 07:00:00 GMT",Isolated theta waves originating from the midline thalamus trigger memory reactivation during NREM sleep in mice - Nature,https://news.google.com/rss/articles/CBMiX0FVX3lxTE1HNDBtZmZKUVYxaWlBblNKZmpCRmtEOHNKX2RJTDJlYlA1R1RNcVdPbGhLVW9FNnVleTNIZlc2TDlNVkllc3d1MGlRalpLSjR4dk15SXFDWDNFMGJWYTJz?oc=5,-0.3182,0
"Wed, 20 Dec 2023 08:00:00 GMT",Theta supercomputer set to retire: A look back at its impact on science at Argonne and beyond - anl.gov,https://news.google.com/rss/articles/CBMivAFBVV95cUxOOFhrY2l3Sk9sOGlyRGhuYnZZdmV5WVpWS3VwbFdaLUxCVWZlU3VSZ2NDYmczYXkxcHlVbHZBdkZ2aEtINHhzRG5zU0tRenZlZnI5OUVpZTk2UU9jRWJMS3REV09QNmUzMmxpY1BMVkctMGd0Q0I5ZzhjOUM5aXJLS3ljNnhib180RGNxX0pLNkg5a0VuM2pQMGY2cThJS2RLWkRaRkEyM1ZGZkotMndHSy03QVJ4bjZ1NXJTSA?oc=5,0.0,0
"Fri, 05 Jul 2024 11:26:45 GMT","Theta–gamma coupling as a ubiquitous brain mechanism: implications for memory, attention, dreaming, imagination, and consciousness - ScienceDirect.com",https://news.google.com/rss/articles/CBMidkFVX3lxTFBZSHVocEpxT1ZSZE5Yajh0bUgtRGFVX1pIYnhpd01zbGtfaVhoeFBicHlwYktwZlNDSURJQ2hhd3BuNEhMWEw5OExKdmpYbXlvenJrMFFzcFA2aC1kSEgzNnR1NGlaUXhjTy02RG9sYXNRMGZpUVE?oc=5,0.0,0
"Sat, 07 Sep 2024 07:00:00 GMT",Optimal level of human intracranial theta activity for behavioral switching in the subthalamo-medio-prefrontal circuit - Nature,https://news.google.com/rss/articles/CBMiX0FVX3lxTFBmekptc3ByWVJBV3ZtOGxiYXBMMHZmTzVKd0RqWlZXQzdyOWY4dlVPck5ESXlSOGY3NUdHT19DUFJGd0hoS01ndnQwdGdJdjM0aVF3SW1wLUZmNU9PUVJn?oc=5,0.3612,0
"Tue, 01 Jun 2021 07:07:27 GMT",The development of theta and alpha neural oscillations from ages 3 to 24 years - ScienceDirect.com,https://news.google.com/rss/articles/CBMidkFVX3lxTE5laTRvcEVCdTJBRTdmVk5nOGV3LXpOQ0JteHRyLW1NREJoVWh5eTYtX3g2V3dtVV9hc3RtSGlFRnFHckVkTnlUMU4zd0RxT0J3WURIYWJBcDRoWGVIZENSYktSejNpYVdudEtHQWVFUTU1WEVNS1E?oc=5,0.0,0
"Wed, 20 Dec 2023 08:00:00 GMT",Construction and modular implementation of the THETA cycle for synthetic CO - Nature,https://news.google.com/rss/articles/CBMiX0FVX3lxTFBQNlhvbld5VjJJVXZjTHpKa2Jtb0dna3hWZGM2N1ViRHJsdm9ZdVNPdUd3WnIwR3pSVldUYXh1WFFsN1JCZ2ozbmhTYVRDSzdTX2pXdkJGRTgyb0FyS0dJ?oc=5,0.0,0
"Tue, 24 Nov 2020 08:00:00 GMT",Somatostatin Neurons Govern Theta Oscillations Induced by Salient Visual Signals - ScienceDirect.com,https://news.google.com/rss/articles/CBMidkFVX3lxTE5sLUF4bTd6dVlOUHpOSFRfQV9fNHFhaUltZlREV01pWmwxakhNTUZma0NrQXpZODRKQ29JMzNQYmhmbFIwOFN0ZXI5U1ZhYmxES2ZQdTM5Ykd0QnJ0QUdZZ1hzd1ZUazJhdmdoRXVDWFNrVnptX1E?oc=5,0.2732,0
"Mon, 24 Jun 2024 18:12:33 GMT",The Theta Rhythm of the Hippocampus: From Neuronal and Circuit Mechanisms to Behavior - Frontiers,https://news.google.com/rss/articles/CBMinwFBVV95cUxPME5VeDNzV0xRSzI4UG1USllJb1Z0eFpnVnZVWWpTc2pQLWNBNDdjUlF0cDNNbmJNdlBOMThVZTVWNWRWejhoalF5MzZYU04tMXg4MTBGdkxfam1pb0ZxM3JvYUdqRTE3ZTNrMDlIazhlUkVubDVmS0ZHN1FNMFo2QVBBQjdUWmpobElreUJVdmo1UnNOZXNVSEFsRE9rcnM?oc=5,0.0,0
"Sat, 29 Jun 2024 16:45:40 GMT",An Evaluation of the EEG Alpha-to-Theta and Theta-to-Alpha Band Ratios as Indexes of Mental Workload - Frontiers,https://news.google.com/rss/articles/CBMimAFBVV95cUxPYXR1UWxYeFoxV0piT1Y4Y0RSSnlxUkZkM0FPenQzUnhqWDlwdmJYb3kyUnpMTjFwajVMR29qYUdvRXpwWmdIS3JuNU45UFdTWmRMdDRhTEg3WlJRMVJUYjJ1TGU2c2p5ZGN0U1BJLU5WTzVUWnFWNkRxZDhJckxNbFh4YTZvY2dBX1FMbUU4elBaTG5KbWh5cg?oc=5,0.0,0
