timestamp,title,link,vader_sentiment,finbert_sentiment
"Thu, 23 Oct 2025 19:01:48 GMT",USC campus welcomes back Kappa Alpha Theta - Carolina News and Reporter |,https://news.google.com/rss/articles/CBMijwFBVV95cUxNdkFrdlBMbVY0VFk0ZV9VU3VsQzRzdE5oNmVkeWxBVVZtdGUwNmJsd0ZsQ1g5bUlmTkFuUy1qdnlrNzZBT3pNMHVET0pKclh2S3ZWZjBrT29zbkRMNlVOSXB5WHREbDFHclZKTnYzeHBwLVJlV19WZW9Pcjc1Vi1ibGotbDRkUUtySUY3ZHpZVQ?oc=5,0.4019,0
"Thu, 23 Oct 2025 19:05:57 GMT",Comorbid Anxiety Lowers Accelerated Theta Burst Response in Depression - HCPLive,https://news.google.com/rss/articles/CBMinAFBVV95cUxPMGlkaF8tZ0dNRTJVcGVCcFdQLXdNU21qMHdoVzNDR0k1aVdSZHV6VU9CMW83bEJqMXlKYWhxZTVKaWlkYlQwUUR4WlFYQ09QcWd3ZnJURE9UMUlWUnVFdkw3em5lVEw2MTRKWW81OGN0UmU4N3A3RjlfR2Q4QUFneG00Mlduc0FCVklqaDhxSXFaYm1HTndULXVBNmc?oc=5,-0.7096,0
"Thu, 23 Oct 2025 13:45:03 GMT",Coahoma Community College to Host Phi Theta Kappa Fall 2025 Induction Ceremony Featuring Mayor Orlando W. Paden as Guest Speaker - coahomacc.edu,https://news.google.com/rss/articles/CBMia0FVX3lxTFBmTlBVNVdzTEpyUFMtVEJFLXR2WmItX2hURS1vNmt3S0lhdWlQMVVQb08zSklXV2FvbW1nLUgxcUhSd1VMSnhlQUtWeDJoUUQ5R2kyVmZqNE95akNpS2RKV1A4bEgwQTBFVFJr?oc=5,0.0,0
"Thu, 23 Oct 2025 04:18:36 GMT",Theta Gold Mines Announces Upcoming General Meeting for Shareholders - TipRanks,https://news.google.com/rss/articles/CBMivAFBVV95cUxNZXdCNXItWk42QUV3UDlibU1ueG5yaEd0TzdjYjA1UHQ0b3dmSnBUMHdiSUhNTy00TkFOSjUzSEVFcFdkMEZJZHoxLVFTd2lKVEFFRHY1WmJZc0tmeFJweDBlSDFzYktWU281NWlNS0owZkxvR3hObWFVRmRSbjVDSVJ2NnA4MWZUaFRSSmd4RXhWeEo0V0dGV015czE3Zm11YTUyWlV3UUtDTDFibkdPNF9JVlVLY3o5WnFPZQ?oc=5,0.0,0
"Mon, 20 Oct 2025 18:03:06 GMT",Theta Brain Waves Act Like Radar to Boost Visual Working Memory - Neuroscience News,https://news.google.com/rss/articles/CBMibkFVX3lxTE5Da0pzMTBocThNaGwtc0xOZjEwR2dCSFIxdWtFZXRHRUJzTlhUMldyaDJwdlhTTTVSTjFiZlQxTjZ6akV6aE4wanY5VWtIdjFmSFZxSUJzS3F0ZlR4ZDhBcU9nTUJjQlF0N25TSWdB?oc=5,0.6369,0
"Tue, 21 Oct 2025 15:00:48 GMT",APSU Phi Alpha Theta Chapter Wins National Best Chapter Award for 2024-25 - Clarksville Online,https://news.google.com/rss/articles/CBMiVkFVX3lxTE9kTVlhWTZwcUVaV285UjVsa0RzMm80dUpHdHhpcTVvQV90V0hsd0J1MnVPVk5IRGZVNWF0OFJHZ0lEckV3OXBoOUhfa2lvUF9zMkgwTGdR?oc=5,0.9081,0
"Tue, 21 Oct 2025 18:05:49 GMT",The Brain’s Hidden Radar: How Theta Waves Sweep the Mind to Spot the Unexpected - The Debrief,https://news.google.com/rss/articles/CBMiowFBVV95cUxNcnNWVWtZVkp6TkItLWxYb0tiQk8teTB4Y3pkSjA5cHlWY2dsc19iWXBYQW9MaHhtZ2h2Z3BiTWs4ckxnZHpEYjUxLU9vb2hYdno3eGs3eElCd0h5MjdyRTc5NGhSNEd0X3hVXzYyT2daYTFHdmpvRmk2SmNrakRhSlo0RUZuTzFyNkstWXEwN1F4Yl9Da18wTjl2WGtzRFBtdjVn?oc=5,0.0,0
"Tue, 21 Oct 2025 21:29:54 GMT",Twenty-Five Years Alcohol-Free: Reflections of Phis Who Led the Change - Phi Delta Theta,https://news.google.com/rss/articles/CBMirgFBVV95cUxNREVENUxmNTIzcjV3QXFFZUJ5cW0wd1IyckpEa1BsU0JrM0RzdGJPTml3S2xQOXJBRjVpWEM5TjRuTVdxWFMwTThHRWx6M01uUjVOdUEyanpTSm93Qk96NTFLd05PMEZZY3U1clJKUXlkRjMzZUpVLUxPdUY2WndOSVhwbWVkLW9XTTBLYnllLWthelJJMkxYMmNpdHFGcENmNFNpM3RVeURWNGhDTlE?oc=5,0.0,0
"Tue, 21 Oct 2025 10:22:11 GMT",Theta Gold Mines Secures Cash With New Share Placement - Finimize,https://news.google.com/rss/articles/CBMiiwFBVV95cUxPNVpjeENIWFcwSURKNzgzMTF6NGc1V2xiTmxNTHJBZS1jQkZ4X1daWUk0QUVTS0x4eUd5Q2htUEdUcnpHanE1VlBaemZHaXRvd1lEQUlDdmtaM0sxZjE5YWdLdjZONG9Jb2NVVVQ0cVZrNjRnNjQ1ZW55cFU4TU5ET09paEQwVzRUaXpN?oc=5,0.5423,0
"Thu, 12 Jun 2025 07:00:00 GMT",Philadelphia Union and Theta Network Announce Multi-Year Partnership - Philadelphia Union,https://news.google.com/rss/articles/CBMiqwFBVV95cUxNR2F5Y2k1aXRtaU13TlNYeHA4YTBEMUtLR3diRW5WdkZPTWhmNmlkMUdLVXY5MkVkM1RraklmWExtWFV5anJJU3hnZloyM2pmcnk3TmNBeGEwWVRtU281NWpXRm9WeURVMmd3UE5VbkF2UUVqLVNpRWRZYzdVUGlhd21uRTFnNDYwQmt5R2ZTdERTa1FXb0FVdlBnbXZ4Q3JjdGVNeXBoak9ZeFE?oc=5,0.0,0
"Mon, 11 Aug 2025 07:00:00 GMT",Theta-phase locking of single neurons during human spatial memory - Nature,https://news.google.com/rss/articles/CBMiX0FVX3lxTE40Z0ItLUtOS0RXOUpMY0ZRRXl6TjVSWlJSdHZsSVBOdE9Id3ZkejBGcXN3MXY4eTN6eGtKU1pLdS05dElIUzczZ1VlUTRHMGw2NG55WjgwOHF0dE1FcTdB?oc=5,0.0,0
"Thu, 04 Sep 2025 07:00:00 GMT",Sigma Theta Tau - UMass Dartmouth,https://news.google.com/rss/articles/CBMicEFVX3lxTFB1TjJJMmdDNDZ3bWJsWmtxLWp6dktzWE1tVEloc2xfYmlsWjdNN3JGWEJoLUdPb0p1R3E4SDlKTUlLRWFQX0hUaEpYWjFyeTdFRDNSNE5wQnI2Sm4wZVlhVVQ5ZEF2UXFJaU4zcGhfcks?oc=5,0.0,0
"Tue, 07 Oct 2025 07:00:00 GMT",Multiple hazing allegations surface against suspended fraternity Theta Chi at VCU - WRIC ABC 8News,https://news.google.com/rss/articles/CBMixwFBVV95cUxNOVlDOGpTRVI2ZE92VVNEWG9BX1FKWXA2SDY3RkYyc0NJUk4zRGhMZkhNRzRkZHY0Nmw0QnhrNEtwOGNzbmZjc0g3UE02Rm12ejhUZ0NQN0p0SVhpMUZoOGxKU1owSlZHTXVXaEFGQTBGU3Z3Ym5tVjNWYURsZ1hsN0hXMFh2MHRHQ0VZSndIYlRiOTBVNV9xU21EUEFiS0lEMGJhZXM3U2ZjSUdsZUpuRjZpUnlwWWp3STRCUG5KaGJBdDAxSjdn0gHMAUFVX3lxTE1kUXA1R3gtMFVzNzJJQTVib3Q1ZXdGbU81X0N4UFNxYzJ1WWNkaDJpT1JQT0I5QXRuM0N0MlJsU3l1dkNmaEticEF3VWJpN1N2c1ozZk9IOFNLUHBkSFNXQm92cU9PQ1UyOGVCbzgzc2xKR2pWeDNpc1BjdHRyaXc1NDU4NGlXM0RVS3BPNDJYbU9WRF80bEZTX2ExZzFzVWZYQl9id1VDa19fWjlWVW8yWWVLRFA0UHhielJ5LXRCNkRNdUFCUjFPT3V5Qw?oc=5,-0.4767,0
"Tue, 22 Jul 2025 07:00:00 GMT","Theta Jewel Honaker Obituary July 22, 2025 - Ertel Funeral Home",https://news.google.com/rss/articles/CBMiaEFVX3lxTE9xbGxiTkFQdHM3MzR1N2xGNC1adHVybjRTc2M1MkJIQmtjSFBvckNwOW9FUk1oa3Q4bXFobEFLTVViLUIzUHhFMmJDUzh3cXRIU2dBS2RXcHpPc0RTWlIyVmVndFc1amQ2?oc=5,0.0,0
"Fri, 17 Oct 2025 02:30:05 GMT",Delta Sigma Theta Mourns Former President Dr. Paulette C. Walker - Blavity News,https://news.google.com/rss/articles/CBMif0FVX3lxTE0zTzYxNkF3bDBWNjlzYWl2cWdsU29pWC1PX2Ntc2VUOGdobUN1X0RtSkowcWtLdEkycW4zbzlKbVE2aE10alZuR3gxbm5xYWN2SXRUU18yc2RPLW1iSnRaUGVVWEFYNjhIenpIOFJJZlhwUUNKQ1hUMWlsalh3Nms?oc=5,-0.5267,0
"Fri, 18 Jul 2025 07:00:00 GMT",Theta-encoded information flow from dorsal CA1 to prelimbic cortex drives memory reconsolidation - ScienceDirect.com,https://news.google.com/rss/articles/CBMidkFVX3lxTE1BZFQwb1hBcDRydFhEMVpVTEZWaHFQZndPRGp0NW1PNjhRRE5qeHZ6QXNLaVEyMmpiN2s4WV9LU0lGRVhETXRXRGlrSlM3dEVHWGtzMWs2eWVfYWhCdmR3Qmd2V2pYYzZrai1HZHlFQkw4ZFhxaVE?oc=5,0.0,0
"Thu, 23 Oct 2025 04:28:38 GMT",Theta Gold Mines Announces General Meeting for Strategic Resolutions - TipRanks,https://news.google.com/rss/articles/CBMivAFBVV95cUxNemlPWmRvTFBFcjh4ckQwNkZDMC1oQmNLS3ZMN2ZHVVNBZEV5OHYxb2hoQ3lJS0VUaFZNcVE5aG92SUVrblJINUJmOVlWQTBXN2cxYkJBWVBpRnVrNUM4Y0QtbHRvdG9OZ3VWcFdXMDlLV0tyQjI0UThBM3hXVjJ5MWhueEdsbk9KRnRCTE91eWdINUwwck5FaUdDVVcxTGFMZHFLbTBBWTU4RFlFYkJtaW9xOXFXNGR2QlVfRg?oc=5,0.0,0
"Tue, 26 Aug 2025 07:00:00 GMT",Allothetic and idiothetic spatial cues control the multiplexed theta phase coding of place cells - Nature,https://news.google.com/rss/articles/CBMiX0FVX3lxTFBjb3RuTzk0ZHZqSEo4QWV3T0g0Z2RpdTRCd05QUVYxb3Z5dUplZnVlN3JMU3RPMTM3d1RtZDBpV2ItZUhOOUR6cmpPM3BaczFVUm9CWTNJVUctcWpQc2lB?oc=5,0.0,0
"Wed, 22 Oct 2025 23:22:03 GMT",Theta Gold Mines Advances TGME Project with Key Milestones - TipRanks,https://news.google.com/rss/articles/CBMirwFBVV95cUxPa2l4VEp5aGd6amFQbVlwU2pNWkZ3WWJGaWdmamFLeW5oM0xWckJ0eExYeHhtVFJnaWdQR2t4N2JsN3dxd0pRSTN4RWVBMVVWSWMwVFh6QkpIVWRnV2xwcVJYR2xqbXNqWEpBdUk2aHdnY1Y3WEhiY0owMkhKTGd0RktHYzBqazJ1MEhzdkpFRGFWcG5aV3U2Ny1VUnMwOW5uem1wSjVvcGNzazNsY0hj?oc=5,0.0,0
"Tue, 21 Oct 2025 02:29:21 GMT",Theta Gold Mines Announces Proposed Securities Issue to Boost Capital - TipRanks,https://news.google.com/rss/articles/CBMiwAFBVV95cUxQU20xTFZQdFRSeGRNRG8zc0I2Sk10RGpILU01MGN1Uy1wbzIzY3pkN0o4VzN4N280T0hFXzRJQUpJNlJEdFg2UDJIdGtzTTg1cWYxRENfbzR5NTJwM2FzYndod1l4bGRRZDBxSWJBdVlSeE5hNkxWT25SOExSTjliLWpVU3lMLTZaR0VhM1g3UTVxQUR5aGRETUhVRjJMMElPVGVBUnRMT0ZLVlQ4QldITTlXbWgyZjRJaVpwSXk1TmI?oc=5,0.5994,0
"Tue, 21 Oct 2025 13:52:00 GMT",Past sorority president remembered as national and community trailblazer - Daytona Times,https://news.google.com/rss/articles/CBMi7AFBVV95cUxNdGlHUkJEWnhaRUtXM2lyWC1kVzlrWFhKb2doTFJIWWhDLXFJbEFzNFdmRVlJUENZYzBicmlmWkJTc1NYWnp4RzNSbVNXUk9fdm1CWDNTc1poMVZlUl9RdmZGNFV0OEFUdnI2RXc2eC1GTzBqZHB5VG1zM1JIb1V1WVlxclRVV0FwU0w4QW9fVFNEeWthejBBbDJ2NE9wUWdLVG1sSTIyejU3aEg0bWp6T1liNmtXYkdSQl9QUVd2S05fcW0xMUJfaWpkQUFtR3haNmU4WmRRU09rY2ZoYTZVTjMzWmQtWXgxYnF5QQ?oc=5,0.0,0
"Wed, 30 Apr 2025 07:00:00 GMT",Closed-loop control of theta oscillations enhances human hippocampal network connectivity - Nature,https://news.google.com/rss/articles/CBMiX0FVX3lxTFBYc1FDUXlfUEoyaThXWkVKeVZ3ald3MWRib0loVXJYMDdDcEdvMFFzbld1LUlGbi1MOG5VLXYtaXU5VmJjQXR2bm04aGhWbnUteXUtTnk0OWFhcFVxRU5n?oc=5,0.0,0
"Tue, 03 Jun 2025 07:00:00 GMT","Launch of the RICOH360 THETA A1: The professional, rugged, and connected 360° camera designed for extreme environments - Ricoh",https://news.google.com/rss/articles/CBMiU0FVX3lxTFBZMmcwX0JUN0tZWTJ6NUk2c1IwNXVBMUFZaDc5dlF2eC0wS25iNlNPb1NwRDNsZ093OEx1SVBfQ3V0VUhaWlUzNktoemlpcWpQSUJz?oc=5,0.0,0
"Tue, 21 Oct 2025 19:01:15 GMT",PRCC Celebrates Academic Excellence with New Phi Theta Kappa Inductees for Fall 2025 - HubCitySPOKES,https://news.google.com/rss/articles/CBMiqAFBVV95cUxQUFJsR0I0djNFY1FMUHo2VGtoX21JWFJxNXM4TFZzSERuVGlRR3A4LUdYXzV1OVlpZmhvXzNaUXFYdjMzSktZV2Mwb3hrSGZfTlpQdkVvWS1tY2FvNC1jQU54ZVBxdDNLWWU2RS0zUlBrWVBsVFYtMVJmazR3RGtPOGNKYVpMRE5iQmtDZENGdlZnbUlqZ2NvVzY3NzBZTVpMeWpGRm5GM3k?oc=5,0.8316,0
"Tue, 19 Aug 2025 17:41:41 GMT",Recruitment Coaching - Phi Delta Theta,https://news.google.com/rss/articles/CBMiYkFVX3lxTE5ycnVKMDBwb1F0R2JHMGRYSjVYaTk4MzlHcHlfSkhrbVBqQ01pLXMxUVZzZk9fd28xdXRma0llTmUtSENUV1E4dVJyVFdKRHljM1plWll5YXNqWGlHNHMwSUx3?oc=5,0.0,0
"Wed, 21 May 2025 07:00:00 GMT",Neocortical and Hippocampal Theta Oscillations Track Audiovisual Integration and Replay of Speech Memories - Journal of Neuroscience,https://news.google.com/rss/articles/CBMiYEFVX3lxTFBGUjhuUkJFZFl5d1U0cXM0bnlmS1BNY0owSDUybzFNYzd3aVdlRXpkN1RxNkF6MUhlZzA4SjVvQzI4TDViNkx0WGpyNFNzOXJjVUF6YkQza2Uwel81SFRMdw?oc=5,0.0,0
"Fri, 06 Jun 2025 07:00:00 GMT",Devils Launch Custom AI Agent Powered by Theta EdgeCloud | RELEASE | New Jersey Devils - NHL.com,https://news.google.com/rss/articles/CBMipwFBVV95cUxQYlhxTWd6UEg1SlJPT19lT0tDNjc5TkkwYi1Fd0pjbEhmWS1EXzdjbENTck1IR1JuaDVnX0J1TFJFY2N3dkZ4MGpVRmtaY1I1YjJreHo1SjdXLVlWeVhIeDAzLVNuUy02OFYzNUxwZjhlcWp3dlA4bmRraTdBSmhOYzZfdmdlVGQyRkdzd2ZEMWVHV2RaLWxwQU1UX1djNnAtMjRXWkFGOA?oc=5,-0.8126,0
"Thu, 31 Jul 2025 07:00:00 GMT",SBU’s Eta Theta Wins Pi Sigma Alpha Honor Society Best Chapter Award for Third Straight Year - SBU News,https://news.google.com/rss/articles/CBMiywFBVV95cUxOOWRLWWJQdTlKTmVjVkQ4QTdjcnIwd0ltMzJHc2Flb25zbjlBdUdOUHU4elJGSHlieThNVC1QS0Q0dUdjNkJ5M3ZqMmJaQThrc0xxZ2kyaGNiLTRGMW02elBONDVPa3JoR0g3bnlDazJFLWR1ZmVGXzlYTXdoS2lDMkQyV3ZjVWVzU0c4aXd2TkFFNFBnencybUdaRDBFZmFENmtzUWUwal85RVpmU24zbTNEa1RrYlgwVW1Vb2RGanYzYWdDYnJNSHJwWQ?oc=5,0.9477,0
"Fri, 11 Jul 2025 07:00:00 GMT","Delta Sigma Theta Sorority Inducts N.C. A&T Alumna, Trailblazer Howroyd as Honorary Member - North Carolina Agricultural and Technical State University",https://news.google.com/rss/articles/CBMiZEFVX3lxTE1QYVlzSUlNWDNVcXUyelpHN181Y3pWSkxud2NOSzN5T1VOLXhKby1HZ3E5cFc1ZWdpMEYtUG9YRE1wMV9TNjJQdDZIRS1FMGtrQ01TZ3YwWVFoM29JU0NqWDBHblI?oc=5,0.34,0
"Thu, 10 Jul 2025 07:00:00 GMT",Theta-frequency subthalamic stimulation enhances conflict resolution in Parkinson’s disease patients with freezing of gait through frontal cortex modulation - Nature,https://news.google.com/rss/articles/CBMiX0FVX3lxTE45clBUNm9YZzhPb0gwc0kzVXc3UEJhclU1T0xnaVBpUllSRnJvc2xjWjcyZUFVSEk5U2JiQnoyMTlDSWRIRk01TjRta0htSl95VDdsbllxQnc4blA3Tmtn?oc=5,-0.4019,0
"Thu, 23 Oct 2025 02:14:11 GMT",Theta unveils ‘crystal clear’ strategy for 2026 - Mining.com.au,https://news.google.com/rss/articles/CBMid0FVX3lxTE5lWDNSeXFmOG9ONy0yc0tudG9xRVFzdl84bVdNVWo5cHhLQndaN042U25KeEtqTDZfblBWOHY0N2pTbUpoa3U0UXRKVC1MWVJPNWozY29LWW9oQUpYanBtZHJ5VzAtcDAyQ2kxeW5PUVNacmNFaW4w?oc=5,0.0,0
"Tue, 01 Jul 2025 07:00:00 GMT",Direct excitatory loop and theta resonance in the anterior cingulate-mediodorsal thalamic circuit - Nature,https://news.google.com/rss/articles/CBMiX0FVX3lxTFA2UUJLdHFqQXpxUzIzYzNBREJGOUM5U2VjV1A1MUNYRUtxbWVHWkdwVkZvcmExajhqWHpnZDQzQTJnelVUWW5EUjgyTTA1WTl3NVZEUXo3Z3dTRHB6YWg0?oc=5,0.2732,0
"Mon, 03 Feb 2025 08:00:00 GMT",Left–right-alternating theta sweeps in entorhinal–hippocampal maps of space - Nature,https://news.google.com/rss/articles/CBMiX0FVX3lxTE45ZGVIWWlQeFB5bmI5RURqUnpMeWVYLTZabTMwWW0wWFI5c0hHaGtLbUZDR3lQbzdRb0RuUThiQmU4ektRUHRPaXg0OVZnNEt1QkNEQUZBZWNiWjdQTzVB?oc=5,0.0,0
"Mon, 17 Mar 2025 07:00:00 GMT",Theta Chi chapter Alpha Tau to host centennial celebration at Ohio University - Ohio University,https://news.google.com/rss/articles/CBMiqAFBVV95cUxQQW9IcUw2ZU55OTMwblluYjYxaXhFTEhxb3hnczhXdTBSc0ltQ3Q1cGgtanJwLTVsMXFqSnk4cTN0Q25MdUdDRHlua0s3VGg5STRFc0RQLWhfY1hocWl3cjFDT1BKekRDX0FSQUFPanJncWw5cFdQQXNsWXM1YUJnWmMteXZiTUpxQTV4bFMwRmd4R0hObFozai11Qmc2NkNWVVNrc1JzdlQ?oc=5,0.0,0
"Thu, 23 Oct 2025 05:07:09 GMT",Bulldozers roll in at Theta’s TGME mine - The Australian,https://news.google.com/rss/articles/CBMi_AFBVV95cUxQVzFGQ0ZMakFaOE9lMUNZd2ZwZ2VDdVRHNWRrQWduY2JVYzI2NUEyQnBvMm43LUppbktFb3hSaVM1blJJckd4bmR6SHV6ZTVWdW5jSWx3QUZpNk1DQm05RHNFaWFHZExiUUc1cVE0ODA5VTZIOXNEbFI5bmk4c3JwbjJyQ1A2RzlkTlk3NzVoZEl0REVSOWxFRXl2cThqOXRuUjE5MDRTNTZkcFF2NVpVSVpLSTdlLUFYeXpqc0dBcVZmZTBhc0xIYmhkTDJaOFUxWENDSGN3SXVlZU55N19GaWFqVnlTR29CcnlwUXdySkdoQWRCR3RvRGN2Z1_SAYICQVVfeXFMT0xYajA4SHRpTmRRZjVhQWE3Z3BMS3V3b1FLaFVnWEN6MVJwWGRzTlVYb0dzRkhLQmRtRGsxaVJRMm13Q3FrejJWZ2NYWFNmcXI0TFdqWFloNmFYS2tJNG5wZVZmc09zMXl3LXllRU5yMlYtcDVhczB4UlpEMTlSMWM0bGhWQWpGTldJQVFXUXpiaWZrd082ZG5PS1hyVXF4TDFiQXJLU0FWNExWU1JENy1kVndHVzhiSFlqeVZqdTlZTkdGWm9NZjNSUG1xUXFYYnJSOG4xdW5BeTY4VGFsbHEwNzQzOE5SdlRETUkxbmRKVXVqZmtDVmlRbWtGRnVkTllB?oc=5,0.0,0
"Mon, 21 Jul 2025 07:00:00 GMT",Delta Sigma Theta Partners with Livingstone College to Offer $1.5 Million in Scholarships to Wayne County Students - Livingstone College,https://news.google.com/rss/articles/CBMi1AFBVV95cUxQaXV0TkJZLXB3UkV2Z1JKMkt5MFc3VVRoYlY1TTJxNXFRdE96ZkhIX204bG5IZkw2Tm9DV3o0NTd5Tmp6R0hDZ2lGcm5SMzdsS3kwS3B3WkRLNWRHVVMtZkdFN2w0SlZZVzB0RkVMLV9sMTBWMTRhQk9BVUdDUGoyYmd4X2FhS1ZqdnJwU0ZsVHo1M3ItQWhCbEIwY21KS19ZbzZnbUtEak1PUmtNbW02NWZnUkpOOEVtLXBsenRwVXBQbjdyVkZfQ0g5MTRhMzVOR0xHaA?oc=5,0.0,0
"Thu, 25 Sep 2025 07:00:00 GMT",Building Brotherhood: Theta Delta Chi - Wabash College,https://news.google.com/rss/articles/CBMiUEFVX3lxTE5FZ3gwYWJpcVdpUUdXWXdaZlhlWWxEbVVHS2V4XzBVTG41Y192cm1MQUxCRVhXaVF3MzR0UWlWN2lfQm1ZWGxsTk1mR2FiWmth?oc=5,0.0,0
"Thu, 19 Jun 2025 07:00:00 GMT",Theta oscillation synchronize VTA and mPFC during ethanol-induced conditioned place preference and stress-evoked anxiety - Nature,https://news.google.com/rss/articles/CBMiX0FVX3lxTFBfdjNUQW11eXdiTVNscXduUFhqX2JybnBpLTVDb1gyNE45MUkxaURjOUM2V3VJTHl4T0UtTlMxeG5RY3ZOWmZ6TUdGekFlb2Fpa1lpN2xBS015THdkMkNn?oc=5,-0.1779,0
"Wed, 03 Sep 2025 07:00:00 GMT",Phi Theta Kappa Students Recognized at Yearly Catalyst Event - Dallas College,https://news.google.com/rss/articles/CBMijgFBVV95cUxOTUhscE1JX0k0N3ZBSHNDb3o1YkZmQmpVQkQ2TFJEQkFnV3draHZLYWR2d2N6WDhrcUtFRzRuWlBGMXFac3J6NXFhOHgzbHY4a1hJYTI1NDY0NjFlaXJ0aS1UQXpwUWxYbWJrbkc3SEk0UjdYMWhDTWZnN1FqNm03N1ZiRjlucU9HZUdCbDhn?oc=5,0.0,0
"Wed, 14 May 2025 07:00:00 GMT",Theta Oscillons in Behaving Rats - Journal of Neuroscience,https://news.google.com/rss/articles/CBMiYEFVX3lxTFBIOFNrb2RDeUNTOXYyRkNWbTQ0RTJNZXVrTW9nN3lOSEJILVJQU00tNGZqYVZJcUt4c2V6VWdOZlU3TTAwMVZBbHFFSnVYR2ZXcjEycnpHVmxHd1BvOVpXNQ?oc=5,0.0,0
"Mon, 21 Jul 2025 07:00:00 GMT",Enhanced theta oscillations in the left temporoparietal region associated with refractory positive symptoms in schizophrenia - Nature,https://news.google.com/rss/articles/CBMiX0FVX3lxTFBoeWwtc2I3MzMwZ0M5b0cyM1hOdGVaaDZxdVl2VTRCbVdVbndlYk5yWFdBVENNbUNsUVVTVU9hNF9HT2N5QXVLX0Q3U0NUYzlMVFFXZmJYZkwwWVM3VlRB?oc=5,0.5574,0
"Mon, 18 Aug 2025 07:00:00 GMT",Southern Miss Selected as One of the Nation’s Most Transfer-Friendly Universities for Eighth Consecutive Year - The University of Southern Mississippi,https://news.google.com/rss/articles/CBMigwFBVV95cUxPdzBDTnV4MnprR0VHOGFtbms0SllyQUdNZURZb01nb0FBd0lsc3pzdGFXekxqVDlScmNSSDFuVWJCYUNtSlFMc1FZZGhpUl9qUFVGOTFtcmloMXUxdllpbGJKU0U4NGtVTUNWTmxacFJ4MDE5U1RwNkpFTzRQMTdwOU04UQ?oc=5,-0.1531,0
"Tue, 05 Aug 2025 07:00:00 GMT",Phi Theta Kappa Transfer Honor Roll recognizes MSU for eighth consecutive year - Mississippi State University,https://news.google.com/rss/articles/CBMivwFBVV95cUxOeFRGcU1leXp0N0ZVV3RtNzkzYVNLOFB5TnBzN1p6TVlJYjktUzFPYk1iY21uOGI3NXdBRnliUGtkZjUwMXZYMWZNbWRJX0FmZDl6WU9aUHIzeVU4Y0FpekwzU0lOYklGWUxtTDhaNmxZU2hqb0pmS3hLNi1ZcG1IeWEzRlF6SkRNZ0RuZTBDSTFvNTUwNV9zd01mZ1VucmUzMHl1WjRUcm1wVEczT3d1WFAzMlJMVDRmU2RtZ09Law?oc=5,0.4939,0
"Thu, 27 Mar 2025 18:35:14 GMT",A new symbol of academic excellence and leadership - Boston College,https://news.google.com/rss/articles/CBMiwwFBVV95cUxONXV0THV4TWRyVlFlWTg1OVFqdWRuM012clZiMVNEOGZlSXBmOTZMTldXcEVJQXdRQzNoemhZZWdzQ2dGSjVwOHdpZjkzRlVXLWJMNGtsbUhseWpxV0dSLXRFNXhUYmhPb2JOdkZHc1otcUhBN3RKVUVzOHNuWFlKSHdxeEdlSGgwTWxlRlN0cGpfWjQ4ZEVCSnBxbVNvUE12dFo4bUw2dGRYVVdMVTc1ZmlhUEhVYi1sQ0txaU90VHlmVnM?oc=5,0.6249,0
"Mon, 17 Feb 2025 08:00:00 GMT",The divine secrets of the WashU Theta sisterhood - WashU,https://news.google.com/rss/articles/CBMiigFBVV95cUxNY2dFR1NPS25vVHhWc1k0aVJyOThtTXZXUXZUZDJmWWxpc3A1UGtJT0VyZ1l5elplLVFQNEVwWkdDTG5URUxCUWpoYVczbndmRVVqOENqYS1oVFFzVVlGOVdtMHJTR0hCNXI4YmNVSEx6RGJ0MVdGX04zc2x2T1QwSG1zT0VNZEFIV3c?oc=5,0.5574,0
"Wed, 28 May 2025 12:57:07 GMT",Cortex-wide spatiotemporal motifs of theta oscillations are coupled to freely moving behavior - Frontiers,https://news.google.com/rss/articles/CBMinwFBVV95cUxQMnJCZ1dobXBYS3dTSWlfbW5VR2Rad3lVSVZfNlM3dzgyQUk4SmhXRk04R2hpQmQ1Nk0zUnUyTVc3M1dpNi1jd3dBUUdJNWZlVzFMQ2RkMTVYT1VKYUNRb0dDZzBNNHlOa1RvR2tOUUplczFhX0lBbU1xTlBDYnZPWERDNHpGN3FEd2J1b2JxTUdBRENxVldjU0JDb1I0Qms?oc=5,0.4404,0
"Mon, 04 Aug 2025 07:00:00 GMT","Theta burst stimulation of temporo-parietal cortex regions for the treatment of persistent auditory hallucinations: a multicentre, randomised, sham-controlled, triple-blind phase 3 trial in Germany - The Lancet",https://news.google.com/rss/articles/CBMiiwFBVV95cUxOWHp6VUY5WXlMUGFsT0FOXzlQcUJmdURiRkNQZFZBOFhNUnpEMlFaXzZrRzlxbkdNSDdmZlhJRlV2V3puV2lacUt0RlRlR3dwRGZsX3Z3YVJDN3ByenVPdjJ0NEVSUkJhYXYwdXAwOEhIam9iVXpWRFZaSWRxd282aExOQ3hrQzA5V0Fv?oc=5,0.0,0
"Mon, 21 Apr 2025 07:00:00 GMT",Phi Delta Theta’s Rock Show for a Cause - The Cornell Daily Sun,https://news.google.com/rss/articles/CBMiigFBVV95cUxPRmxOby1FR3hUVC0tMDlXT0pFczE5N25LV3o4UXVNamE0ckFvYTk5Ul9aYkV1Y2h6My00bWJqTmZHVGtVSWpfM294V1lpZFNEOVVzR1llQWZPU1pnVjVYRWVDVDVYeDJrY1dkWGUwenVmLUFDdklVRmNvbWJaMGhVSVFsUlhlRVVuM1E?oc=5,0.0,0
"Mon, 14 Jul 2025 07:00:00 GMT",Frazer School wins Mu Alpha Theta national championship - Mainstreet Daily News,https://news.google.com/rss/articles/CBMiqgFBVV95cUxQVUdhdUNvTnVrY2hWMF9Wa1UzazFPS2pVZDlGRkJhNWxMaVFjZ1ZmYVNoZEhYeVBIbDFHTThBcU9qV0M2X0tBNnpKcFA3TFlRT3FCSnIyWVAtckVWTnhfemd0aVRpY0RkOW52OHlYcDkxekZiMFMzbkplUC1iZTB1Ykp0dHdfX3cyYi1fYUhyUi13Rl9xZ2RJZjJ1bmE3RTNFREN1dFdDRzNtUQ?oc=5,0.765,0
"Wed, 16 Apr 2025 07:00:00 GMT",Synchronous Theta Networks Characterize Successful Memory Retrieval - Journal of Neuroscience,https://news.google.com/rss/articles/CBMiYEFVX3lxTE9sWk9pTThuaHdJa2xaTFI5VnZSUEdHNG1yWXI4Q0NNRmxvZ2h3aHJwZ2x0dmpKR2pQMjlkd2ZXbmJWYzBaNjRDdDNjVGFKci04YlhWSHlSaXRCTm1HMDZPOA?oc=5,0.5859,0
"Fri, 25 Jul 2025 06:56:01 GMT",Disrupted theta oscillation propagation in healthy elderly individuals with apolipoprotein E epsilon 4 allele - Frontiers,https://news.google.com/rss/articles/CBMilAFBVV95cUxOQWd5T2hnNzgzQ3NvRVNDNVNtenJFZmNzZ3lza3FuZElmUmZfdm1KdXVEMUFfbi1qbG9Pd2xhY3o2b09zMVBSazVEeWFHMWtfeDREMzZ5VDNEWGFsZHItRHJvWG1EcHRaUUFORmFqU2duNmdic0ZET0FFcEJuaUxEOEJFQWI1OHB5RUs5WXZ0b193aWxp?oc=5,0.4019,0
"Wed, 22 Oct 2025 09:15:00 GMT","Altcoin Price Setup Today: AAVE, ALGO, THETA, and ADA as Bitcoin Holds 59% Dominance - Coin Edition",https://news.google.com/rss/articles/CBMipwFBVV95cUxNVzFhLUxkNVgxTzBqby0wdHJZN1BiMDk2NmViVTdkMUpoWHgxOEI5RUlCV3dHaWdEZEJMdUJPREx1OVVvN3JLUXB6WG9NZ0dZR1JmaUxqZkRPbHU5Znh3amh4eDg0NGp6OFJHb21LM2ZETS1HSXd4RkxTUTRpeUJRb1Buemp6d2phelNmSTdkcTdIalhQWm92UWh3aXhxX3MtazRNYUliVQ?oc=5,0.2023,0
"Tue, 04 Mar 2025 08:00:00 GMT",Breakthrough study sheds light on Pol-theta’s role in DNA repair and cancer - News-Medical,https://news.google.com/rss/articles/CBMixwFBVV95cUxPMmZKa2JpbTl4cDdEU24ydUxaOEplQ01LYVVtczNINGtjUDZsNnhrallGOVJPX2RCbEhkTDlaRmJRbjh4M1BycFdsMXhNcjRuWkozbWJBVzJ1YkpNUVYwZ2FEeXBKT0Riek1MWjFVRnhrMXhMQkt2TkZiY1drazMxOGN4WkVRVEczdkZTLTNyN2Z4eHRCVEhqRklXTnc3d1B5LWR5OF9tNUJCVnMtZHJPT3JoSmhhYWlPZ0lScDJtcmlrVFFLMzRj?oc=5,-0.6597,0
"Mon, 21 Jul 2025 07:00:00 GMT",Memory dependent modulation of hippocampal theta power through frontoparietal phase synchronous brain stimulation - Nature,https://news.google.com/rss/articles/CBMiX0FVX3lxTE9xUUtIaGgzWTZSQ0g2dko1NzJObUNzZFZHeFRYZ002UTFPbUZuTHJoN3hia2QtXzcwb01udVV3WWRkanFEVmJqeXFZc0dnbHJGQWFCMDRrN3k3bVN3NjVB?oc=5,0.0,0
"Thu, 21 Aug 2025 07:00:00 GMT",Exploring the impact of fixed theta values in RoPE on character-level language model performance and efficiency - Frontiers,https://news.google.com/rss/articles/CBMimgFBVV95cUxOcU5KS2NPM2F1dFl2aWRoUjZWcmdWUE5qU05MendpcjJZbUVyX3kwQ3FsWkY5cU5qUklrTURHd1FEZnFNbHhXMTVUOW5GT2c2YnlxTk1SSWZMcTkwTkM0bVk5Wmktb3lsN29wOEQ0QkxNZUZTNEljRE9yc2pJRTBpTE03TW9ZTnBfZ1JMWmNQek5OYmFvNXRNQ09R?oc=5,0.6369,0
"Sat, 02 Aug 2025 07:00:00 GMT",Uncovering the role of directed connectivity in alpha and theta band activity for sustaining perception-action links - Nature,https://news.google.com/rss/articles/CBMiX0FVX3lxTE8wbWlLYzBPb0VIc3FKQlZEaHVSRFQzRWpIQXl6QzFpdk9La1Z5cldDaVpjcmNVTWNlWkFySjBZV1l1RXhEZTlnelRKWklkYkstWkpiRk9QN0VvN3BRb1M0?oc=5,0.0,0
"Mon, 06 Jan 2025 08:00:00 GMT",Origin of visual experience-dependent theta oscillations - ScienceDirect.com,https://news.google.com/rss/articles/CBMidkFVX3lxTFBqSEZyam0tbnFMLWVha3FvcTVHUDJiMFlCcWxhZVhTbmxHMWl0MnlENGxwM1R1NFhsRFFiazRVYW9ILUFfUHA3UXJkWERtYl9SUTdQNUJyOU9kUmZvdGlkeHdkanJtajEyZHVTbzhicWIzZWJ2M3c?oc=5,0.0,0
"Sun, 22 Jun 2025 07:00:00 GMT",Theta-gamma coupling: nonlinearity as a universal cross-frequency coupling mechanism - Frontiers,https://news.google.com/rss/articles/CBMiowFBVV95cUxQajlyRGxHN2t2ZGlRQ2ZkWE5yN2licXZrWFZyeFdNR3dhQ0tTVWhpRGJrWXZuTFVhYUZYOEFsR0I1UXJmVkVFclA3QmlPZDVDQVBNWEdpWkI1WXEteEg0VTV2TjZwV0FaN19veGJlTGVlcFlpb0ZfdzhNZ0xKd3ZjQXhGWmU5X1k5WDRBUnU0eV84dXV1SGJxZWhUaTlyaFExSk84?oc=5,0.0,0
"Fri, 05 Sep 2025 07:00:00 GMT",Phi Delta Theta WV Gamma Earns National Recognition at Biennial Convention - West Liberty University,https://news.google.com/rss/articles/CBMiaEFVX3lxTE9rWVZtZFRBd3Q1QUJ0MDdMSWJGRTRDSGdTY09LQmxFTmp4UTNIbmJNa0dDWkVLTGJwOUtnVUhsaUhCQXZJclhCR2pjUDhoX2tSWWM5WTRidVppeFNmUG1tZUFBTWVuZk9R0gFuQVVfeXFMTUFkZG52RWZHRUhZY05CVFBzb0FxSHVsOXA1T2thUm5aNlY0ODJJbEJha1ZJdkJfcjVaQVVSOHh6RHZ5VHdHb01sSWQ3YzlZcTY3VFI4MVgtM0ZKTld0T2hiX3J4VjNWVE9tOWo4dXc?oc=5,0.5267,0
"Wed, 25 Jun 2025 07:00:00 GMT",Sustained Hippocampal Theta Oscillations Reflect Experience-Dependent Learning in Backward Temporal Order Memory Retrieval - Journal of Neuroscience,https://news.google.com/rss/articles/CBMiigFBVV95cUxOMzRwNkxSWDVCZkRnN0xUaEhEQXJKZUVCak1EX2FnT1Y1XzJPbWxqc1hNeUY5azQzcmJfaHZDRkJIbDVNWGQ3Z1dTUHhxdEdDNDJpcF9YdW94MEpGRFBhNWlqTS0xd0R5eDRpdWlyX0Q1d0VlVmRWWW5qTHF0bVFJOG9EQzlqWGRsUWc?oc=5,0.0,0
"Wed, 22 Oct 2025 07:00:00 GMT",Delta Sigma Theta chapter donates $500 to Hallandale Beach Police Athletic League - Citizen Portal AI,https://news.google.com/rss/articles/CBMi9AFBVV95cUxPOFA0WEhLSHd3MTZqa1VvLUtTS2JkVVhXS0UzWV9ZMDNZUnlZM1ByeXROR0lBYS03UzA5Q1g5cXA4a2laclJXVW52NE50YUo1MFl4WWtrbkluRE1nRHpiLWxHTE9iQUFvQVZQbi1EYVJSbXJLQVlYMU82T2ZxYU56bDhMRk5Ocm9FMjVtU29UMkpzcktDaVA0ZUt6M0xocmQxM0JfVXVxNHc1RC1EM3BfcFZwTWZvUGhUYjd6NDh0SW04bVpqM3d5azBwRlFBU3Q3cUFKcjBDR2V1SVg2eWhzSGJrX2NZUjNxOUhCWXYtVnBwMDJD?oc=5,0.0,0
"Thu, 20 Mar 2025 07:00:00 GMT",Theta Chi and Alpha Sigma Phi lead stream clean-up initiative - Auburn University,https://news.google.com/rss/articles/CBMihgFBVV95cUxPYVZ0QWdvMUttam1Xd1JVc1VDYmlJVWxaX1VvLVF1cDlkMkpSdVpsTWRVc3JqS25TNmVZZmZ5TkppQnZJQVQwQ1ctdWpJb2hMRkx4ZENYREYySWpzWFlqRndkeUdkdDFNRklMaV9XVFY0bUwzM1hFdlpsNll0U0FLMEhUY2g4dw?oc=5,0.0,0
"Wed, 22 Jan 2025 08:00:00 GMT",Actress Sydney Sweeney named Theta Chi “sweetheart” - The Miami Hurricane,https://news.google.com/rss/articles/CBMilgFBVV95cUxQdmQtdkpRS09hbWg4S2ZOTUJ0a2QyV0tib2dDdTlvOUUweUhfcmRoWDZGdTFJTzZLTG05UjBnblRzNVJUbFhGOU9CNE85bDZJNkJES1RjdnlQd3pCTENMeFdCeFVnSTRVUUh6Z1hLSXZJMVgxbDlqNnNlejdlTDFpNUl1aUdadnMwSWliTWVXMW9hNWNvMmc?oc=5,0.0,0
"Wed, 05 Mar 2025 08:00:00 GMT",Investigating the kinetics of single-chain expansion upon release in theta conditions - Nature,https://news.google.com/rss/articles/CBMiX0FVX3lxTE5ER2NHWEE2aVFBZkZWdTdHeTROdVEzRjlpVFNNSlA0UWxhSVRCc1J5UElFSmtYNDVVRlNBQ0U2M0h6aWdyMVJORjRDUVdGNGtQdm1hWTJ5NnVxSWFLdEZN?oc=5,0.0,0
"Sat, 29 Mar 2025 07:00:00 GMT",Lateral frontopolar theta-band activity supports flexible switching between emotion regulation strategies - Nature,https://news.google.com/rss/articles/CBMiX0FVX3lxTE1BY053UFVyRkZld3EzQ00xZmRwUTBRT1hDeW9JWjZuVVY1M19EVEU2eFM3aTlSRThkQmhaNmFmb1RPOXRPVUxCVk1ybFpITWxwbzJJTklDa1Nrc3JLT3hv?oc=5,0.5267,0
"Wed, 14 May 2025 07:00:00 GMT",A role for preparatory midfrontal theta in autism as revealed by a high executive load brain–computer interface reverse spelling task - Nature,https://news.google.com/rss/articles/CBMiX0FVX3lxTE1BSlZlMzVveElHbkVsSW1SaUlYaTFPdi1KVERFbVlTYldaUy0yZWVqdElYZ0RsbzN5UjJHOEl6MDMtSktGLUR5UFAwbWVadi1lMnhqcjBsMjhHZmJ1UHow?oc=5,0.0,0
"Fri, 23 May 2025 07:00:00 GMT",Job Posting – Controller - Phi Delta Theta,https://news.google.com/rss/articles/CBMib0FVX3lxTE9FMnphelBQRG0wUzZWaFJyVGszVlpZMWxGcFFIT01hc2lpLVUwRkNCWXFHSXJLS25pYUZhb0FMNU0tZGNVVFNvV1o4UHc4T1pMVXFVYXBCRUk1ZTNZb2JKbElVc29lRHlqZ1lNbXZLRQ?oc=5,0.0,0
